{
  "protocol": "webteam.review.v1",
  "task_id": "WT-142-BE-01",
  "reviewer": "webteam-reviewer",
  "source_revision": "NO_GIT_PILOT",
  "verdict": "INCONCLUSIVE",
  "findings": [],
  "coverage_notes": "Fixture only; no repository diff provided",
  "missing_evidence": [
    "Real repository access and test evidence"
  ]
}
